"magazine","year","month","seq_issue","page_no","category","title","sub-title","author(s)","photographer(s)","optional-1","optional-2","optional-3"
"FoMRHI","1993","1","70","C-1134","Review","Harvey:  Violin fraud: deception, forgery, theft, and the law, 1992","126 pp","Montagu",""
"FoMRHI","1993","1","70","C-1135","None","Bouwbrief articles (summarises nr 65 to 67)","","Chiverton",""
"FoMRHI","1993","1","70","C-1136","None","The clarinet d'amour: e request for additional information","","Rice",""
"FoMRHI","1993","1","70","C-1137","None","Woodwind instrument making: use of gun drills for long hole boring","supplement to C-957","Goodacre",""
"FoMRHI","1993","1","70","C-1138","None","Woodwind instrument making: wooden collet chucks for lathe work","","Goodacre",""
"FoMRHI","1993","1","70","C-1139","None","Drilling and boring process for chanters and drones","","McLaren",""
"FoMRHI","1993","1","70","C-1140","None","A case for CNC (Computer Numeric Control)","computer aided reamer production for woodwind instruments","Jefferies",""
"FoMRHI","1993","1","70","C-1141","None","Low cost CNC (Computer Numeric Control)","","Jefferies",""
"FoMRHI","1993","1","70","C-1142","None","Re C-1119","","Stanley",""
"FoMRHI","1993","1","70","C-1143","None","Meanness of tone","re C-1119","M. Lyndon-Jones",""
"FoMRHI","1993","1","70","C-1144","None","On the contrary","re C-1119","G. Lyndon-Jones",""
"FoMRHI","1993","1","70","C-1145","None","Comments on C-1119","","G. Lyndon-Jones",""
"FoMRHI","1993","1","70","C-1146","None","Re C-1119","","Grazzi",""
"FoMRHI","1993","1","70","C-1147","None","Beethoven and the early music industry","","Segerman",""
"FoMRHI","1993","1","70","C-1148","None","On embellishment function and context","","Segerman",""
"FoMRHI","1993","1","70","C-1149","None","Applying the principles of stringing plucked instruments to the Irish harp","","Segerman",""
"FoMRHI","1993","1","70","C-1150","None","An attribution of an unsigned spinet","","Wraight",""
"FoMRHI","1993","1","70","C-1151","None","Harpsichord dampers","historic vs. modern","Irvin",""
"FoMRHI","1993","1","70","C-1152","None","Through dampers (double dampers)","","Irvin",""
"FoMRHI","1993","1","70","C-1153","None","More on sympathetic strings","","Irvin",""
"FoMRHI","1993","4","71","C-1154","Review","van Acht: Checklist of technical drawings of musical instruments in public collections of the world, 185 pp., 1992","","Montagu",""
"FoMRHI","1993","4","71","C-1155","None","1992 Report from the Czechoslovakian Society of Makers of Historical Reproduction Musical Instruments","","Freeman",""
"FoMRHI","1993","4","71","C-1156","None","Cow bells, a request","","Montagu",""
"FoMRHI","1993","4","71","C-1157","None","More on Beethoven and the early music industry","","Montagu",""
"FoMRHI","1993","4","71","C-1158","None","On current uniformity in performing style","","Segerman",""
"FoMRHI","1993","4","71","C-1159","None","Conflicting philosophies in the bassoon controversy","","Segerman",""
"FoMRHI","1993","4","71","C-1160","None","The hallmark of good restoration is ruthless authenticity","","White",""
"FoMRHI","1993","4","71","C-1161","None","Reamers - hollow","","Loretto",""
"FoMRHI","1993","4","71","C-1162","None","Make your own imitation ivory","","Ackerman",""
"FoMRHI","1993","4","71","C-1163","None","CNCs, the sledgehammer and the nut","","Ackerman",""
"FoMRHI","1993","4","71","C-1164","None","The `Zängelmass' of the wire drawer","a documentary confirmation of the 16th century","Gug",""
"FoMRHI","1993","4","71","C-1165","None","On harpsichord dampers again","","Greenberg",""
"FoMRHI","1993","4","71","C-1166","None","A comment on C-1150","","Koster",""
"FoMRHI","1993","4","71","C-1167","None","Medieval sound boxes, to be glued or not","","Segerman",""
"FoMRHI","1993","4","71","C-1168","None","Fingerboard shapes and graded frets","","Segerman",""
"FoMRHI","1993","4","71","C-1169","None","Recreating the Irish harp - a comment to C-1149","","Downing",""
"FoMRHI","1993","4","71","","General","1992 Acquisitions at the Fiske Museum","","",""
"FoMRHI","1993","4","71","","General","CIMCIM publications currently available","","",""
"FoMRHI","1993","4","71","","General","Instructions for working tagua nuts, a substitute for ivory","","",""
"FoMRHI","1993","4","71","","General","Tutors from the Bate Collection","","",""
"FoMRHI","1993","4","71","","Supplement","an addition to C-1130","","",""
"FoMRHI","1993","7","72","C-1170","Review","CIMCIM publication no.1: Recommendation for the conservation of musical instruments: an annotated bibliography. 19 pp. 1993","","Montagu",""
"FoMRHI","1993","7","72","C-1171","Review","Journal of the Australian Association of musical instrument makers, vol.XII no.1, March '93","","Montagu",""
"FoMRHI","1993","7","72","C-1172","None","Do you get excited when the postman brings your Q","","Lyndon-Jones",""
"FoMRHI","1993","7","72","C-1173","None","Welcome back the Hunter - income from the ivory trade is the best assurance for the survival of elephants","","Jenkins",""
"FoMRHI","1993","7","72","C-1174","None","A counterblast to the Calvinist tendency (further to C-1119, C-1143, C-1146, C-1159, C-1160)","","Bavington",""
"FoMRHI","1993","7","72","C-1175","None","Blow somewhat strong","","Wood",""
"FoMRHI","1993","7","72","C-1176","None","A preliminary reply to C-1119 and C-1160","","Kirckpatrick",""
"FoMRHI","1993","7","72","C-1177","None","A rejoinder to a response to C-1157","","Montagu",""
"FoMRHI","1993","7","72","C-1178","None","A comm on C-1137, C-1161, C-1163","","Jefferies",""
"FoMRHI","1993","7","72","C-1179","None","A low cost CAD/CAM","","Jefferies",""
"FoMRHI","1993","7","72","C-1180","None","Request for information (an Italian harpsichord)","","Greenberg",""
"FoMRHI","1993","7","72","C-1181","None","Some remarks on the W. Beukers baroque oboe (museum code 808/69) in the V&A Museum in London","","Bouterse",""
"FoMRHI","1993","7","72","C-1182","None","Medieval glues ... sounded well","","Gug",""
"FoMRHI","1993","7","72","","Plans","Drawings available. Bouterse","","",""
"FoMRHI","1993","7","72","","Supplement","Correction to C-1129","","",""
"FoMRHI","1993","7","72","","Supplement","English viol bellies, made of bent strip","","Segerman",""
"FoMRHI","1993","7","72","","Supplement","Restoration, on an article in the New Scientist, 26 June 1993","","Segerman",""
"FoMRHI","1993","10","73","C-1183","Review","The Woodwind Quartely, issue 2","","Montagu",""
"FoMRHI","1993","10","73","C-1184","Review","Giannini:  Great flute makers of France: the Lot and Godfroy families 1650-1900","","Montagu",""
"FoMRHI","1993","10","73","C-1185","Review","Novak Clinkscale:  Makers of the piano 1700-1820","","Cole",""
"FoMRHI","1993","10","73","C-1186","None","Real instruments and fake putti","","Lyndon-Jones",""
"FoMRHI","1993","10","73","C-1187","None","An interesting organ loft in Antwerp","","Lyndon-Jones",""
"FoMRHI","1993","10","73","C-1188","None","Memlinc revisited - further to C-203, C-411 and C-659","","Montagu",""
"FoMRHI","1993","10","73","C-1189","None","Timber - swelling and shrinking","","Allen",""
"FoMRHI","1993","10","73","C-1190","None","A letter on the Pythagorean system. Raudonikas","","",""
"FoMRHI","1993","10","73","C-1191","None","Response to Bavington's C-1174 criticising criticism of Early Musicians","","Segerman",""
"FoMRHI","1993","10","73","C-1192","None","Response to Wood's C-1175 criticising criticism of Early Musicians","","Segerman",""
"FoMRHI","1993","10","73","C-1193","None","The sharp eared minority and the effects of its power","","Segerman",""
"FoMRHI","1993","10","73","C-1194","None","Where have all the creative amateurs gone","","Segerman",""
"FoMRHI","1993","10","73","C-1195","None","Ruthless authenticity","","Jefferies",""
"FoMRHI","1993","10","73","C-1196","None","Relevant CNC","","Jefferies",""
"FoMRHI","1993","10","73","C-1197","None","Positioning pivot holes in turned rings","","Gill",""
"FoMRHI","1993","10","73","C-1198","None","A simple way to hold work on a lathe","","Ransley",""
"FoMRHI","1993","10","73","C-1199","None","Authentic methods of making woodwinds","","Ramsley",""
"FoMRHI","1993","10","73","C-1200","None","The sizes and pitches of Praetorius's sackbuts","","Segerman",""
"FoMRHI","1993","10","73","C-1201","None","Mean-tone fretting by computer or calculator","","Segerman",""
"FoMRHI","1993","10","73","C-1202","None","Violin makers in Milano 17th-18th century","","Chiesa",""
"FoMRHI","1993","10","73","C-1203","None","Catlin(g)s: the etymology","","Catch",""
"FoMRHI","1993","10","73","C-1204","None","Equal tension stringing of the Irish harp","","Downing",""
"FoMRHI","1993","10","73","C-1205","None","Mortice and tenon joints on the Irish harp","","Downing",""
"FoMRHI","1993","10","73","","General","Brassware for keyboard instruments","","Law",""
"FoMRHI","1993","10","73","","Plans","List of workshop drawings from the Edinburgh University Collection of Historic Musical Instruments","","",""
"FoMRHI","1994","1","74","C-1206","Review","Gillian Sheldrick, ed.:  The accounts of Thomas Green 1742-1790","","",""
"FoMRHI","1994","1","74","C-1207","Review","Joseph Doane:  A musical Directory for the year 1794","","Montagu",""
"FoMRHI","1994","1","74","C-1208","None","Peter Holman, Four and twenty fiddlers","the violin at the English Court 1540-1690. 491 pp","Montagu",""
"FoMRHI","1994","1","74","C-1209","Review","William Waterhouse:  The new Langwill index - a dictionary of musical instrument makers and inventors. 518 pp","","Montagu",""
"FoMRHI","1994","1","74","C-1210","Review","Larigot","annual subscription to ACIMV","Montagu",""
"FoMRHI","1994","1","74","C-1211","Review","Edinburgh Collection of Historic Musical Instruments, catalogue Vol 2;E;ii, William Waterhouse, Bassoons","","Montagu",""
"FoMRHI","1994","1","74","C-1211","Review","Edinburgh Collection of Historic Musical Instruments, catalogue Vol 2;H;iii, Arnold Myers & Raymond Parks, Trumpets and Trombones","","Montagu",""
"FoMRHI","1994","1","74","C-1212","None","What can we reasonably expect museums to provide or allow? (on measuring instruments)","","Montagu",""
"FoMRHI","1994","1","74","C-1213","None","Measuring instruments in museums & conservation","","Ransley",""
"FoMRHI","1994","1","74","C-1214","None","Suppliers of materials","","Gill",""
"FoMRHI","1994","1","74","C-1215","None","A reply to comments from various members on C-1174","","Bavington",""
"FoMRHI","1994","1","74","C-1216","None","Some observations on the `natural' trumpet","","Barclay",""
"FoMRHI","1994","1","74","C-1217","None","On musicologists and early music","","Segerman",""
"FoMRHI","1994","1","74","C-1218","None","Scholarship, statistics, and the minimum amount of evidence needed","","Segerman",""
"FoMRHI","1994","1","74","C-1219","None","Well under a thousand words for the ivory ban","","Powell",""
"FoMRHI","1994","1","74","C-1220","None","Praetorius' keyless curtals","","Lyndon-Jones",""
"FoMRHI","1994","1","74","C-1221","None","A wizard lizard (a 5-keyed cornett in the Stadtmuseum of Munich)","","Lyndon-Jones",""
"FoMRHI","1994","1","74","C-1222","None","Checklist of some of the woodwinds at the Stadtmuseum, Munich","","Lyndon-Jones",""
"FoMRHI","1994","1","74","C-1223","None","On the difference between early and modern baroque reeds","","Segerman",""
"FoMRHI","1994","1","74","C-1224","None","Augsburg revisited (the curtals in the Maximilian Museum)","","Lyndon-Jones",""
"FoMRHI","1994","1","74","C-1225","None","C.N.C. reamer experiment. July 1992","","Jefferies",""
"FoMRHI","1994","1","74","C-1226","None","Some historical notes on acid staining","","Owen",""
"FoMRHI","1994","1","74","C-1227","None","Expanding boxwood and playing in","","Kirckpatrick",""
"FoMRHI","1994","1","74","C-1228","None","The good oil","what really happens when you oil your recorder","Simmons",""
"FoMRHI","1994","1","74","C-1229","None","Restoration report, 17th century Italian harpsichord at Music-Sources, 1993","","Greenberg",""
"FoMRHI","1994","1","74","C-1230","None","Harpsichord voicing","","Cole",""
"FoMRHI","1994","1","74","C-1231","None","Milanese keyboard makers - 16th century","","Chiesa",""
"FoMRHI","1994","1","74","C-1232","None","An alphabetical string gauge system","","Downing",""
"FoMRHI","1994","1","74","C-1233","None","A c. 1900 string gauge and an unwound viola C string","","Segerman",""
"FoMRHI","1994","1","74","C-1234","None","Historical violin stringings up to 1900","","Segerman",""
"FoMRHI","1994","1","74","C-1235","None","On catlines and Pistoy basses","","Segerman",""
"FoMRHI","1994","1","74","C-1236","None","Bogwood again (further to C-1074)","","Downing",""
"FoMRHI","1994","1","74","C-1237","None","Below bridge bars in lutes - a missing link","","Downing",""
"FoMRHI","1994","1","74","","General","African ebony","","",""
"FoMRHI","1994","1","74","","General","Genuine boxwood","","",""
"FoMRHI","1994","4","75","C-1238","Review","Cooke:  Edinburgh University collection of historical instruments, catalogue, vol 2A, wind instruments of regional cultures worldwide","","Montagu",""
"FoMRHI","1994","4","75","C-1239","Review","Lenski, Ventzke:  Das goldene Zeitalter der Flöte, Frankreich 1832-1932, 270 pp., Montagu","","",""
"FoMRHI","1994","4","75","C-1240","Review","van Ree Bernard:  The keyed monochord","rediscovery of a forgotten instrument, 48 pp","Montagu",""
"FoMRHI","1994","4","75","C-1241","Review","Virdung:  Musica Getutscht, (tr Beth Bullard), 275 pp","","Montagu",""
"FoMRHI","1994","4","75","C-1242","None","The FoMRHI Quarterly review of `Makers of the Piano 1700-1820', a question of interpretation or a statement of misunderstanding (further to C-1185)","","Novak Clinkscale",""
"FoMRHI","1994","4","75","C-1243","None","Somewhat about understandings (further to C-1190)","","Raudonikas",""
"FoMRHI","1994","4","75","C-1244","None","Unwelcome honesty doesn't help - a response to C-1216 (and to C-1215)","","Segerman",""
"FoMRHI","1994","4","75","C-1245","None","Are our instruments HISTORIC or HISTORICAL","","Myers",""
"FoMRHI","1994","4","75","C-1246","None","Association in instrument collections","","Myers",""
"FoMRHI","1994","4","75","C-1247","None","Nominal pitch","","Myers",""
"FoMRHI","1994","4","75","C-1248","None","Measuring instrument pitch with a pocket tuner","","Downing",""
"FoMRHI","1994","4","75","C-1249","None","On the measurement of tessitura and movement in music","","Segerman",""
"FoMRHI","1994","4","75","C-1250","None","An equal tempered scale for tempo","","Segerman",""
"FoMRHI","1994","4","75","C-1251","None","Gerle on tempo","","Segerman",""
"FoMRHI","1994","4","75","C-1252","None","The transposing organ and choir pitch in England: a short test","","Goetze",""
"FoMRHI","1994","4","75","C-1253","None","Early instruments in St Petersburg","","Henning",""
"FoMRHI","1994","4","75","C-1254","None","Catlin, coloured and loaded strings","","Catch",""
"FoMRHI","1994","4","75","C-1255","None","On historical string tensions on lutes","","Segerman",""
"FoMRHI","1994","4","75","C-1256","None","Stringing 5-course baroque guitars","","Segerman",""
"FoMRHI","1994","4","75","C-1257","None","The curtals of the Maximilian Museum Augsburg: a reply to C-1224","","Tremmel",""
"FoMRHI","1994","4","75","C-1258","None","Making a stamp or branding iron for marking musical instruments","","King",""
"FoMRHI","1994","4","75","C-1259","None","Three boxwood oboes by Hendrik Richters","","Bouterse",""
"FoMRHI","1994","4","75","C-1260","None","Woodwinds - boring pipes","","Downing",""
"FoMRHI","1994","4","75","C-1261","None","The transposing organ and choir pitch in England: answers to C-1252)","","Goetze",""
"FoMRHI","1994","4","75","C-1262","None","Key lever fulcrum pin mortices","","Robson",""
"FoMRHI","1994","4","75","C-1263","None","On the wings of the muse or songs of historical feathers (on harpsichord quills and voicing)","","Gug",""
"FoMRHI","1994","4","75","C-1264","None","The Canadian vocalion","","Downing",""
"FoMRHI","1994","4","75","C-1265","None","The nature of theoretical musical communication","","Raudonikas",""
"FoMRHI","1994","4","75","C-1266","None","Syntax of relative two-dimensional mode","","Raudonikas",""
"FoMRHI","1994","4","75","","General","1993 Acquisitions at the Fiske Museum","","",""
"FoMRHI","1994","4","75","","General","CompuServe announcement on making musical instruments","","",""
"FoMRHI","1994","4","75","","Plans","Bate collection, three new plans (flutes by Delerablé, Lot, and Kirst)","","",""
"FoMRHI","1994","7","76","C-1267","Review","Pierre Erard:  The harp in its present improved state compared with the original pedal harp, London 1821","","Montagu",""
"FoMRHI","1994","7","76","C-1267","Review","Robert Bruce Armstrong:  The Highland harp (part 2 of `Musical Instruments, Edinburgh 1904)","","Montagu",""
"FoMRHI","1994","7","76","C-1268","Review","Larigot 15, June 1994, ACIMV","","Montagu",""
"FoMRHI","1994","7","76","C-1269","Review","Stephen Morey:  Mandolins of the 18th century, 154 pp","","Montagu",""
"FoMRHI","1994","7","76","C-1270","Review","Phillip T. Young:  4900 historical woodwind instruments, 270 pp","","Montagu",""
"FoMRHI","1994","7","76","C-1271","None","Questions on bending and a plan for crumhorns","","Buck",""
"FoMRHI","1994","7","76","C-1272","None","`Let us now praise famous men ...', an obituary for Michael Morrow","","Montagu",""
"FoMRHI","1994","7","76","C-1273","None","Michael Morrow","","Segerman",""
"FoMRHI","1994","7","76","C-1274","None","Reply to Raudonikas's C-1243","","Segerman",""
"FoMRHI","1994","7","76","C-1275","None","Letter to the membership as whole (further to C-1243)","","Raudonikas",""
"FoMRHI","1994","7","76","C-1276","None","Occam's razor: the formal method for ensuring objectivity in scholarship","","Segerman",""
"FoMRHI","1994","7","76","C-1277","None","FoMRHI on the Internet","","Rawson",""
"FoMRHI","1994","7","76","C-1278","None","A kinder, gentler FoMRHI","","Cronin",""
"FoMRHI","1994","7","76","C-1279","None","On writing a history of the oboe in the 19th century","","Burgess",""
"FoMRHI","1994","7","76","C-1280","None","A `bajón' for London","","Waterhouse",""
"FoMRHI","1994","7","76","C-1281","None","Forces exerted by bore measuring techniques","","Cronin",""
"FoMRHI","1994","7","76","C-1282","None","Early sound generation: bassoon reeds","","White",""
"FoMRHI","1994","7","76","C-1283","None","Making one's Mark","","Lyndon-Jones",""
"FoMRHI","1994","7","76","C-1284","None","More putti in the Stiftsbasilika at Waldsassen","","Lyndon-Jones",""
"FoMRHI","1994","7","76","C-1285","None","A note on `the good oil' (C-1228) by T. Simmons","","Guida",""
"FoMRHI","1994","7","76","C-1286","None","Theobald Böhm as a flute maker","","Böhm",""
"FoMRHI","1994","7","76","C-1287","None","The scale of the psalter","","Crookes",""
"FoMRHI","1994","7","76","C-1288","None","On Venice catlins, lyons, Pistoy basses and loaded weighted bass gut strings (see also C-1235, C-1254 and C-1255)","","Peruffo",""
"FoMRHI","1994","7","76","C-1289","None","More on the name `catline' (see also C-1254)","","Segerman",""
"FoMRHI","1994","7","76","C-1290","None","On early 17th century English vocal and organ pitches","","Segerman",""
"FoMRHI","1994","7","76","","General","Portraits in the Royal College of Music, London","","",""
"FoMRHI","1994","7","76","","Plans","Bate collection, two new plans (harpsichords by William Smith, and by Joannes Goermans)","","",""
"FoMRHI","1994","7","76","","Plans","List Royal College of Music, London","","",""
"FoMRHI","1994","7","76","","Supplement","On C-1245 (`historic' or `historical')","","",""
"FoMRHI","1994","7","76","","Supplement","On C-1278 (disputational style)","","",""
"FoMRHI","1994","10","77","C-1291","Review","John Koster: Keyboard musical instruments in the Museum of Fine Arts Boston (408 pp)","","Irvin",""
"FoMRHI","1994","10","77","C-1292","Review","John Koster: Keyboard musical instruments in the Museum of Fine Arts Boston (408 pp)","","Cole",""
"FoMRHI","1994","10","77","C-1293","Review","Pauline Rushton, ed.:  European musical instruments in Liverpool Museum (182 pp)","","Cole",""
"FoMRHI","1994","10","77","C-1294","Review","Pauline Rushton, ed.:  European musical instruments in Liverpool Museum (182 pp)","","Montagu",""
"FoMRHI","1994","10","77","C-1295","Review","Eszter Fontana, Friedemann Hellwig, Klaus Martius:  Historische Lacke und Beizen auf Musikinstrumenten in deutschsprachigen Quellen bis 1900 (158 pp)","","Segerman",""
"FoMRHI","1994","10","77","C-1296","Review","Florence Gétrau, ed.: La recherche en organologie","les instruments de musique occidenteaux, 1960-1992","Montagu",""
"FoMRHI","1994","10","77","C-1297","Review","Gerhard Stradner, ed.: Klangführer durch die Sammlung alter Musikinstrumente, Wien, Kunsthistorisches Museum","","Montagu",""
"FoMRHI","1994","10","77","C-1298","None","A method of bushing wrestplanks","","Law",""
"FoMRHI","1994","10","77","C-1299","None","The Davidic notation system, a sequel to C-1287","","Crookes",""
"FoMRHI","1994","10","77","C-1300","None","the internet mailing lists and Micat-L","","Stroom",""
"FoMRHI","1994","10","77","C-1301","None","Further to C-1278 `a kinder, gentler FoMRHI'","","Spohr",""
"FoMRHI","1994","10","77","C-1302","None","Thoughts on C-1276 `Occam's razor'","","White",""
"FoMRHI","1994","10","77","C-1303","None","Response to C-1302 on Occam's razor","","Segerman",""
"FoMRHI","1994","10","77","C-1304","None","For an open and honest FoMRHI - reply to C-1218","","Segerman",""
"FoMRHI","1994","10","77","C-1305","None","Four great curtals from Augsburg, Sonderhausen and Pillnitz","","Lyndon-Jones",""
"FoMRHI","1994","10","77","C-1306","None","Instruments at Schloss Pillnitz","","Lyndon-Jones",""
"FoMRHI","1994","10","77","C-1307","None","On historical lute string types and tensions (including a response to C-1288)","","Segerman",""
"FoMRHI","1994","10","77","C-1308","None","Strings and their names","","Catch",""
"FoMRHI","1994","10","77","C-1309","None","On melodic and continuo bowing of early fiddles and viols","","Segerman",""
"FoMRHI","1994","10","77","","Supplement","On C-1287 by D.Z. Crookes","","Segerman",""
"FoMRHI","1994","10","77","","Supplement","On Early Music and music history","","Segerman",""
"FoMRHI","1995","1","78","C-1310","Review","The Hoogsteder Exhibition of Music & Painting in the Golden Age","","",""
"FoMRHI","1995","1","78","C-1311","Review","Griscomb & Lasocki: The recorder - a guide to writings about the instrument for players & researchers","","",""
"FoMRHI","1995","1","78","C-1312","Review","Gerhard Stradner, ed.: Klangführer durch die Sammlung alter Musikinstrumente, Wien, Kunsthistorisches Museum - part 2 (further to C-1297)","","Montagu",""
"FoMRHI","1995","1","78","C-1313","None","The British Clavichord Society BCE","","Alexander-Max",""
"FoMRHI","1995","1","78","C-1314","None","On manners, status and C-1301","","Segerman",""
"FoMRHI","1995","1","78","C-1315","None","The world according to Segerman","","Stroom",""
"FoMRHI","1995","1","78","C-1316","None","Contrasts between string and woodwind gracing in Purcell's time","","Segerman",""
"FoMRHI","1995","1","78","C-1317","None","On the scholarship of string names, a reply to C-1308","","Segerman",""
"FoMRHI","1995","1","78","C-1318","None","Roped gut bass strings - a 16th century reference","","Downing",""
"FoMRHI","1995","1","78","C-1319","None","Chinese catlines","","Downing",""
"FoMRHI","1995","1","78","C-1320","None","All at sea with the ship's cat","","Downing",""
"FoMRHI","1995","1","78","C-1321","None","Talbot's English theorbo reconsidered","","van Edwards",""
"FoMRHI","1995","1","78","C-1322","None","Geometrical design of the lute belly","","Chiverton",""
"FoMRHI","1995","1","78","C-1323","None","Ebony","","Camwood ltd.",""
"FoMRHI","1995","1","78","C-1324","None","Lute: angled bridges, `J' shaped bars, fan bars and below the bridge transverse bars","","Mather",""
"FoMRHI","1995","1","78","C-1325","None","Further help with C-1197","","Mather",""
"FoMRHI","1995","1","78","C-1326","None","David's three-part organum (sequel to C-1299)","","Crookes",""
"FoMRHI","1995","1","78","C-1327","None","Praetorius' brass instruments and cammerthon","","Heavens, Segerman",""
"FoMRHI","1995","1","78","C-1328","None","Praetorius' pitchpipe pfeifflin zur Chormass","","Heavens",""
"FoMRHI","1995","1","78","C-1329","None","Transposing organs and pitch in England: response to Segerman's C-1290","","Goetze",""
"FoMRHI","1995","1","78","","Supplement","Wood absorption (further to C-1227, C-1228, C-1285)","","",""
"FoMRHI","1995","4","79","C-1330","Review","Katalin Komlós: Fortepianos and their music. 158 pp","","Cole",""
"FoMRHI","1995","4","79","C-1331","Review","William Waterhouse: The new Langwill Index: a dictionary of musical wind instrument makers and inventors","","",""
"FoMRHI","1995","4","79","C-1332","None","Thoughts after the New Langwill Index","","Smith",""
"FoMRHI","1995","4","79","C-1333","None","A reply to Jeremy Montagu's review of Richard Griscomb & David Lasocki, the Recorder: a guide to writings about the instrument for players and researchers (C-1311)","","Lasocki",""
"FoMRHI","1995","4","79","C-1334","None","About the difficulties of delivering a message and some replies to C-1314","","Spohr",""
"FoMRHI","1995","4","79","C-1335","None","On Stroom's C-1315","","Segerman",""
"FoMRHI","1995","4","79","C-1336","None","A revised hypothesis for the early music meaning of the word `Consort'","","Segerman",""
"FoMRHI","1995","4","79","C-1337","None","Wood science","","Beament",""
"FoMRHI","1995","4","79","C-1338","None","Preserving passion and conviction: fend off the flaccid","","White",""
"FoMRHI","1995","4","79","C-1339","None","Where do we want to go","","Rawson",""
