"magazine","year","month","seq_issue","page_no","category","title","sub-title","author(s)","photographer(s)","optional-1","optional-2","optional-3"
"FoMRHI","1983","7","32","C-470","None","Moisture blocking of fipple flutes","","Willetts",""
"FoMRHI","1983","7","32","C-471","None","Comments on bows and their screws, taps, dies and lathes","","Mather",""
"FoMRHI","1983","7","32","C-472","None","Put the gurus out to grass","","Crookes",""
"FoMRHI","1983","7","32","C-473","None","Comments on C-448","","Montagu",""
"FoMRHI","1983","7","32","C-474","None","Acid staining of hardwoods","","Willetts",""
"FoMRHI","1983","7","32","C-475","None","Woodwind bore oil","","Willetts",""
"FoMRHI","1983","7","32","C-476","None","How to make your own mouldings in wood","","Hendry",""
"FoMRHI","1983","7","32","C-477","None","What is a historical instrument","","Segerman",""
"FoMRHI","1983","7","32","C-478","Review","Cheape: A check-list of the bagpipes in the Edinburgh collection","","Montagu",""
"FoMRHI","1983","7","32","C-479","Review","Cross: The Shrine to Music Museum, vol 2 instruments of Burma, India, Nepal, Thailand, Tibet","","Montagu",""
"FoMRHI","1983","7","32","C-480","Review","Vorreiter: Die schönsten Musikinstrumente des Altertums","","Montagu",""
"FoMRHI","1983","7","32","C-481","None","Bingham, Catalogue of old brasswind instruments","","Montagu",""
"FoMRHI","1983","7","32","C-482","Review","Ueno Gakuen College Tokio: Catalogue of the European musical instruments of the 17th-19th century","","Montagu",""
"FoMRHI","1983","7","32","C-483","Review","Overton: Der Zink, Geschichte, Bauweise and Spieltechnik eines historischen Musikinstruments","","Gretton",""
"FoMRHI","1983","10","33","C-484","None","Notes on a painting by Sabastino Lazzari","","Downing",""
"FoMRHI","1983","10","33","C-485","None","The NF treble recorder at the Museum der Stadt Meran","","Zaniol",""
"FoMRHI","1983","10","33","C-486","None","Geometrical description and analysis of instrument shapes","considerations on early 16th century lute construction","Steinberg",""
"FoMRHI","1983","10","33","C-487","None","Bone for peg decoration","","Jenkins",""
"FoMRHI","1983","10","33","C-488","None","The fingered 16' on the harpsichord","","Shann",""
"FoMRHI","1983","10","33","C-489","None","Comments on C-417 and C-420","","Samson",""
"FoMRHI","1983","10","33","C-490","None","Mersenne, Praetorius and the English viol pitch standard: problems of the history of early pitches","","Meeùs",""
"FoMRHI","1983","10","33","C-491","None","Response to C-490 on English viol pitches","","Segerman",""
"FoMRHI","1983","10","33","C-492","None","Untitled (tuning conical bore woodwind instruments)","","Marvin",""
"FoMRHI","1983","10","33","C-493","None","Fingering the Gaita galega: the horse speaks","","Stacey",""
"FoMRHI","1983","10","33","C-494","None","Health-shop historicity","","Crookes",""
"FoMRHI","1983","10","33","C-495","None","No posterity for the eunuch flute","","Crookes",""
"FoMRHI","1983","10","33","C-496","Review","Schrammek, Herre: Museum Musicum Leipzig","","Henning",""
"FoMRHI","1983","10","33","C-497","Review","Waterhouse: The proud bassoon (catalogue)","","Montagu",""
"FoMRHI","1983","10","33","C-498","Review","Henkel: Musikinstrumenten Museum Leipzig band 4 Clavichorde","","Montagu",""
"FoMRHI","1983","10","33","C-498","Review","Heyde: Musikinstrumenten Museum Leipzig band 5 Hörner und Zinken","","Montagu",""
"FoMRHI","1983","10","33","C-499","Review","Stradner: Linzer Musikinstrumente der Bruckner-Zeit, Linz","","Montagu",""
"FoMRHI","1983","10","33","C-500b","None","Untitled (and some more)","","Kolberg",""
"FoMRHI","1983","10","33","C-500","None","Trouble with C-302 varnish","","Segerman",""
"FoMRHI","1984","1","34","C-501","None","The UKIC and V&A Christmas symposium","","Montagu",""
"FoMRHI","1984","1","34","C-502","None","Some comments on C-477","","Gretton",""
"FoMRHI","1984","1","34","C-503","None","Effects applicable to the tuning of instruments with a conical bore (replaces C-457)","","van der Heide",""
"FoMRHI","1984","1","34","C-504","None","How to make a baroque trumpet (II)","","van der Heide",""
"FoMRHI","1984","1","34","C-505","None","Comments on C-483: review of Der Zink","","Overton",""
"FoMRHI","1984","1","34","C-506","None","18th century success of copal varnish","","Segerman",""
"FoMRHI","1984","1","34","C-507","None","Lunatic crumhorn","","Crookes",""
"FoMRHI","1984","1","34","C-508","None","Observations prelusive to reconstructing the kithara","","Crookes",""
"FoMRHI","1984","1","34","C-509","None","Conjectures about making harpsichord bentsides","","Lee",""
"FoMRHI","1984","1","34","C-510","None","The key system of the organistrum","","Gibson",""
"FoMRHI","1984","1","34","C-511","None","Dean castle: van Raalte collection organs","","Coetze",""
"FoMRHI","1984","1","34","C-512","None","Drilling bristle-holes in wooden jacks","","Groom",""
"FoMRHI","1984","1","34","C-513","None","Comments on C-488: the fingered 16'","","Meeùs",""
"FoMRHI","1984","1","34","C-514","None","Recorder voicing: answers to questions","","Willoughby",""
"FoMRHI","1984","1","34","C-515","Review","Henkel: Beiträge zum historischen Cembalobau","","Wraight",""
"FoMRHI","1984","1","34","C-516","Review","Tibia-Calendrium 1984","","Montagu",""
"FoMRHI","1984","1","34","C-517","Review","Barclay: Anatomy of an exhibition: the look of music","","Montagu",""
"FoMRHI","1984","1","34","C-518","Review","Mactaggart: Painting and marbling harpsichord cases","","Montagu",""
"FoMRHI","1984","1","34","C-519","Review","Gernhardt, Henkel, Schrammek: Musikinstrumenten Museum Leipzig band 6 Orgelinstrumente, Harmoniums","","Montagu",""
"FoMRHI","1984","1","34","C-520","Review","van Acht: Volksmuziek en volksmuziekinstrumenten in Europa, Haags Gemeente Museum","","Montagu",""
"FoMRHI","1984","1","34","C-521","Review","Brauchli: Carlos Seixas's nine sonatas for clavichord (record)","","Montagu",""
"FoMRHI","1984","4","35","C-522","None","The Icelandic langspil","","Crookes",""
"FoMRHI","1984","4","35","C-523","None","Trends towards historical accuracy in popular design","","Segerman",""
"FoMRHI","1984","4","35","C-524","None","Was the violin a French invention after all","","Segerman",""
"FoMRHI","1984","4","35","C-525","None","Fingerboard length on the baroque violin","","Segerman",""
"FoMRHI","1984","4","35","C-526","None","Comments on Bull. Supp. 34: O'Kelly table","","O'Kelly",""
"FoMRHI","1984","4","35","C-527","None","Lute string calculation and identification","","O'Kelly",""
"FoMRHI","1984","4","35","C-528","None","Further on early manufacture of gut strings","","Zaniol",""
"FoMRHI","1984","4","35","C-529","None","Further on C-514","","Zaniol",""
"FoMRHI","1984","4","35","C-530","None","Notes on Theobald Böhm's article on the open G-sharp key","","Böhm",""
"FoMRHI","1984","4","35","C-531","None","The Mary Rose shawm or dulcina","","Lyndon-Jones",""
"FoMRHI","1984","4","35","C-532","None","The fornication of recorder windways","","Marvin",""
"FoMRHI","1984","4","35","C-533","None","Miscellaneous comments","","Cronin",""
"FoMRHI","1984","4","35","C-534","None","The oldest organ in Christendom","","Montagu",""
"FoMRHI","1984","4","35","C-535","None","Using the pitchmeter and digituner","","Crowe",""
"FoMRHI","1984","4","35","C-536","None","Some thoughts on the use of renaissance legends","","Crookes",""
"FoMRHI","1984","4","35","C-537","None","Flemish transposing harpsichords - some rejoinders answered","","Shann",""
"FoMRHI","1984","4","35","","Plans","List Royal College of Music, London","","",""
"FoMRHI","1984","4","35","","Plans","List woodwind, Bate collection, Oxford","","",""
"FoMRHI","1984","7","36","C-538","None","Italian two-manual harpsichords","","Wraight",""
"FoMRHI","1984","7","36","C-539","None","Comments","","Way",""
"FoMRHI","1984","7","36","C-540","None","Bending harpsichord bentsides","","Shann",""
"FoMRHI","1984","7","36","C-541","None","Further to C-529","","Willoughby",""
"FoMRHI","1984","7","36","C-542","None","Making a Roman cornu","","Barton",""
"FoMRHI","1984","7","36","C-543","None","Response to C-533","","Hailperin",""
"FoMRHI","1984","7","36","C-544","None","Making a bodhrán without steaming","","Crookes",""
"FoMRHI","1984","7","36","C-545","None","On making stitched drumheads","","Gould",""
"FoMRHI","1984","7","36","C-546","None","Three unrelated rebukes","","Crookes",""
"FoMRHI","1984","7","36","C-547","None","Figures relevant to C-546","","Segerman",""
"FoMRHI","1984","7","36","C-548","None","Steel music wire","","Karp",""
"FoMRHI","1984","7","36","C-549","None","Reply to C-526","","Segerman",""
"FoMRHI","1984","7","36","C-550","None","The lengths of bows in the baroque","","Segerman",""
"FoMRHI","1984","7","36","C-551","None","Converting note names & cents to frequency values by micro computer","","Owen",""
"FoMRHI","1984","7","36","C-552","Review","Quarna: vivera di Strumenti","","Montagu",""
"FoMRHI","1984","7","36","C-553","Review","Lund: The sounds of prehistoric Scandinavia (record)","","Montagu",""
"FoMRHI","1984","7","36","C-554","Review","Praxis vol.1, Studi e testi sull' interpretazione della musica, 1983","","Montagu",""
"FoMRHI","1984","7","36","C-555","Review","Lindley: Lutes, viols & temperaments","","Montagu",""
"FoMRHI","1984","7","36","","Plans","List woodwind, Bate collection, Oxford","","",""
"FoMRHI","1984","10","37","C-556","Review","Lindley: Lutes, viols & temperaments","","Hodgson",""
"FoMRHI","1984","10","37","C-557","None","Viol bellies and bridges","","Munck",""
"FoMRHI","1984","10","37","C-558","None","Frau Musica detected","","Henning",""
"FoMRHI","1984","10","37","C-559","None","Partial response to C-442, C-490 & C-491 (pitch standards)","","Crighton",""
"FoMRHI","1984","10","37","C-560","None","A tiny harp made from bog oak","","Crookes",""
"FoMRHI","1984","10","37","C-561","None","Progress report on the kithara","","Crookes",""
"FoMRHI","1984","10","37","C-562","None","More cello spikes and lute strings","","Crookes",""
"FoMRHI","1984","10","37","C-563","None","Why gut treble strings are the best","","Segerman",""
"FoMRHI","1984","10","37","C-564","None","A thicknessing procedure for baroque and modern bows","","Segerman",""
"FoMRHI","1984","10","37","C-565","None","Wood for bows","","Jenkins",""
"FoMRHI","1984","10","37","C-566","None","A reply to C-505 (Overton)","","Gretton",""
"FoMRHI","1984","10","37","C-567","None","Making mild steel (flat-stock) reamers","","Willoughby",""
"FoMRHI","1984","10","37","C-568","None","To hell with whither - it's what that counts","","Montagu",""
"FoMRHI","1984","10","37","C-569","None","The transition from octave to unison stringing","","Shann",""
"FoMRHI","1984","10","37","C-570","None","The colour of the Ruckers' wood-grain paper","","Shann",""
"FoMRHI","1984","10","37","C-571","None","Scraping plane for mouldings in wood","","Greenberg",""
"FoMRHI","1984","10","37","C-572","None","Bending bentsides using steam or hot-iron","","Greenberg",""
"FoMRHI","1984","10","37","C-573","None","Re: C-540","","Way",""
"FoMRHI","1984","10","37","C-574","None","Harpsichord bottom screws","","Way",""
"FoMRHI","1984","10","37","C-575","None","Tentative observations about barred soundboards","","Way",""
"FoMRHI","1984","10","37","C-576","None","Non-ferrous harpsichord wire","","Way",""
"FoMRHI","1984","10","37","C-577","None","Installing soundboard wet and dry","","Way",""
"FoMRHI","1984","10","37","","Plans","List woodwind, Bate collection, Oxford","","",""
"FoMRHI","1985","1","38","C-578","Review","The new Grove dictionary of musical instruments 3 vol. Montagu","","",""
"FoMRHI","1985","1","38","C-579","Review","Bingham: Patents for inventions related to musical instruments, 1694-1866","","Montagu",""
"FoMRHI","1985","1","38","C-580","Review","Bingham: Harmony for the flute","","Montagu",""
"FoMRHI","1985","1","38","C-581","Review","Stacey, Wishart: Bagpipes & hurdy-gurdies","","Montagu",""
"FoMRHI","1985","1","38","C-582","Review","Woodfield: The early history of the viol","","Montagu",""
"FoMRHI","1985","1","38","C-583","Review","Mactaggart: Practical guilding","","Montagu",""
"FoMRHI","1985","1","38","C-584","Review","Taylor: The musician's piano atlas, suppl 1","","Montagu",""
"FoMRHI","1985","1","38","C-585","None","List of northern French makers","","Delassus",""
"FoMRHI","1985","1","38","C-586","None","Re: scraping plane in C-571","","Young",""
"FoMRHI","1985","1","38","C-587","None","Materials and tone quality","","Cronin",""
"FoMRHI","1985","1","38","C-588","None","A contribution to authenticity in the art of drum making","","Gould",""
"FoMRHI","1985","1","38","C-589","None","Did nothing survive from Roman antiquity","","Crookes",""
"FoMRHI","1985","1","38","C-590","None","Some Nietzschean aphorisms to stir up trouble","","Crookes",""
"FoMRHI","1985","1","38","C-591","None","Some historical data on harpsichords","","Shann",""
"FoMRHI","1985","1","38","C-592","None","Bentsides again","","Shann",""
"FoMRHI","1985","1","38","C-593","None","The pitch of Ruckers instruments","","Shann",""
"FoMRHI","1985","1","38","C-594","None","Possible reconstruction of Stradivarius cellos","","Smith",""
"FoMRHI","1985","1","38","C-595","None","Baroque cello spikes","","Smith",""
"FoMRHI","1985","1","38","C-596","None","Response to Crighton's C-559","","Segerman",""
"FoMRHI","1985","1","38","C-597","None","English viol sizes and pitches","","Segerman",""
"FoMRHI","1985","1","38","C-598","None","What Praetorius wrote on English viols","","Segerman",""
"FoMRHI","1985","1","38","C-599","None","King Henry VIII's stump","","Chiverton",""
"FoMRHI","1985","1","38","","Plans","List woodwind, Bate collection, Oxford","","",""
"FoMRHI","1985","4","39","C-600","Review","Fischer: The renaissance sackbut and its use today","","Montagu",""
"FoMRHI","1985","4","39","C-601","Review","Barnes: Making a spinet by traditional methods","","Montagu",""
"FoMRHI","1985","4","39","C-602","Review","Schott: The historical harpsichord, vol.1","","Montagu",""
"FoMRHI","1985","4","39","C-603","Review","Biber: 16 Rosenkrantzsonaten (record)","","Montagu",""
"FoMRHI","1985","4","39","C-604","Review","The new Grove dictionary of musical instruments (A). Montagu","","",""
"FoMRHI","1985","4","39","C-605","Review","The new Grove dictionary of musical instruments. Segerman","","",""
"FoMRHI","1985","4","39","C-606","Review","Karp: The pitches of 18th century strung keyboard","","Segerman",""
"FoMRHI","1985","4","39","C-607","None","Praetorius, Segerman and the English viols","","Meeùs",""
"FoMRHI","1985","4","39","C-608","None","An unpublished letter by Michael Praetorius","","Meeùs",""
"FoMRHI","1985","4","39","C-609","None","More on Denis Gaultier, Sohne, Zarlino et al","","Lindley",""
"FoMRHI","1985","4","39","C-610","None","The vihuela","","McCormack",""
"FoMRHI","1985","4","39","C-611","None","What was the viole d'aline","","Crookes",""
"FoMRHI","1985","4","39","C-612","None","What was the Bohemian wing","","Crookes",""
"FoMRHI","1985","4","39","C-613","None","Response to Crookes's C-589 and C-590","","Segerman",""
"FoMRHI","1985","4","39","C-614","None","Grove on the chekker","","Shann",""
"FoMRHI","1985","4","39","C-615","None","Provisional check-list of surviving clavicytheria","","Bavington",""
"FoMRHI","1985","4","39","C-616","None","Oil and varnish","","Mactaggart",""
"FoMRHI","1985","4","39","C-617","None","Pale drying oil","","Wadsworth",""
"FoMRHI","1985","4","39","C-618","None","Start lean, finish fat","","Forrester",""
"FoMRHI","1985","4","39","C-619","None","Method for drilling the hinge pin hole in the foot of a traverso","","van Leeuwen",""
"FoMRHI","1985","4","39","C-620","None","Untitled","","Kolberg",""
"FoMRHI","1985","4","39","","Plans","List Société des Amis du Musée Instrumental, Paris","","",""
"FoMRHI","1985","7","40","C-621","Review","The new Grove dictionary of musical instruments (A)","","Segerman",""
"FoMRHI","1985","7","40","C-622","Review","Barnes: Making a spinet by traditional methods","","Shann",""
"FoMRHI","1985","7","40","C-623","None","Ruckers transposing double harpsichords","","Shortridge",""
"FoMRHI","1985","7","40","C-624","None","Authentic and all that jazz","","Way",""
"FoMRHI","1985","7","40","C-625","None","Axioms for archaeology","","Way",""
"FoMRHI","1985","7","40","C-626","None","Uniformity in old wire","","Way",""
"FoMRHI","1985","7","40","C-627","None","Keyboard pitch in the 18th century","","Karp",""
"FoMRHI","1985","7","40","C-628","None","The case of the unknown scholar and the missing lute","","Hodgson",""
"FoMRHI","1985","7","40","C-629","None","Response to C-610 on vihuelas","","Segerman",""
"FoMRHI","1985","7","40","C-630","None","Pitch notation: a plea to end confusion","","Myers",""
"FoMRHI","1985","7","40","C-631","None","Comments on C-610 (vihuelas)","","Gill",""
"FoMRHI","1985","7","40","C-632","None","A closer look at pitch ranges of gut strings","","Segerman",""
"FoMRHI","1985","7","40","C-633","None","Praetorius, Meeùs and the English viols","","Segerman",""
"FoMRHI","1985","7","40","C-634","None","The Bohemian wing","","Matou(vsek",""
"FoMRHI","1985","7","40","C-635","None","Reconstruction of the harpate wing","","Crookes",""
"FoMRHI","1985","7","40","C-636","None","Some instruments of skomorokhi from the 1630s","","Crookes",""
"FoMRHI","1985","7","40","C-637","None","Further to C-613","","Crookes",""
"FoMRHI","1985","7","40","C-638","None","The new Grove eunuch-flute article","","Crookes",""
"FoMRHI","1985","7","40","C-639","None","Some measurements techniques for recorders","","Stroom",""
"FoMRHI","1985","7","40","C-640","None","Two links with antiquity: Kundera's zert and the zhaleyka","","Crookes",""
"FoMRHI","1985","7","40","C-641","None","The microwave way: drying boxwood fast and easy","","Bouterse",""
"FoMRHI","1985","7","40","C-642","None","Report about our researches in historical brass metal","","Thein",""
"FoMRHI","1985","7","40","","Plans","Bressan recorder from Bate collection, Oxford","","",""
"FoMRHI","1985","7","40","","Plans","List Metropolitan Museum of Art, New York","","",""
"FoMRHI","1985","7","40","","Plans","Terton recorder from Haags Gemeente Museum","","Stroom",""
"FoMRHI","1985","10","41","C-643","Review","Nema, Early music in education","","Montagu",""
"FoMRHI","1985","10","41","C-644","Review","Good: The Eddy collection of musical instruments","a check-list","Montagu",""
"FoMRHI","1985","10","41","C-645","Review","Kunitachi College, Tokio: Catalogue 3, Bowed stringed-instruments","","Montagu",""
"FoMRHI","1985","10","41","C-645","Review","Kunitachi College, Tokio: Catalogue 4, Plucked stringed-instruments","","Montagu",""
"FoMRHI","1985","10","41","C-645","Review","Kunitachi College, Tokio: Catalogue 5, Harp","Lyre","Montagu",""
"FoMRHI","1985","10","41","C-646","Review","The new Grove dictionary of musical instruments. Montagu (B)","","",""
"FoMRHI","1985","10","41","C-647","Review","The new Grove dictionary of musical instruments. Segerman (Ba)","","",""
"FoMRHI","1985","10","41","C-648","None","Reamer-saving counterbores","","Marvin",""
"FoMRHI","1985","10","41","C-649","None","A flexible recorder","","Marvin",""
"FoMRHI","1985","10","41","C-650","None","Apologies to Sverre","","Marvin",""
"FoMRHI","1985","10","41","C-651","None","A Bassano flauto","","Marvin",""
"FoMRHI","1985","10","41","C-652","None","Tuning recorders","","Marvin",""
"FoMRHI","1985","10","41","C-653","None","Tuning the traverso","","Bouterse",""
"FoMRHI","1985","10","41","C-654","None","Recorder voicing structures","","Woods",""
"FoMRHI","1985","10","41","C-655","None","FoMRHI communication","","Karp",""
"FoMRHI","1985","10","41","C-656","None","A Greenlandic drum","","Crookes",""
"FoMRHI","1985","10","41","C-657","None","Some developments in Spanish musical life","","Harris",""
"FoMRHI","1985","10","41","C-658","None","A flying visit to Italy","","Montagu",""
"FoMRHI","1985","10","41","C-659","None","Speculation on Memling's tromba marina","","Davies",""
"FoMRHI","1985","10","41","C-660","None","Comments on C-629 on vihuelas","","Gill",""
"FoMRHI","1985","10","41","C-661","None","Discussion of points on violas and vihuelas in C-660","","Segerman",""
"FoMRHI","1985","10","41","C-662","None","On cammer-ton and on the sizes of lutes","","Hodgson",""
"FoMRHI","1985","10","41","C-663","None","The stringing of a baroque guitar","","Hodgson",""
"FoMRHI","1985","10","41","C-665","None","Ruckers doubles - a survey of the theories","","Shann",""
"FoMRHI","1985","10","41","C-665","None","Some ways with means","","Segerman",""
"FoMRHI","1985","10","41","C-666","None","Swedish gauge system","","Gug",""
"FoMRHI","1986","1","42","C-667","Review","Fluke: Victorian reed organs and harmoniums","","Montagu",""
"FoMRHI","1986","1","42","C-668","Review","Journal of the Australian Association of musical instrument makers, Aug '85","","Montagu",""
"FoMRHI","1986","1","42","C-669","Review","Myers: The Glen account book 1838-1853","","Montagu",""
"FoMRHI","1986","1","42","C-670","Review","Simon: Händel: a celebration of his life and times","","Wollenberg",""
"FoMRHI","1986","1","42","C-671","Review","The new Grove dictionary of musical instruments. Montagu (C)","","",""
"FoMRHI","1986","1","42","C-672","Review","The new Grove dictionary of musical instruments. Segerman (Bb-Bz)","","",""
"FoMRHI","1986","1","42","C-673","None","A return visit to Venice","","Montagu",""
"FoMRHI","1986","1","42","C-674","None","A reamer made of aluminium","","Janke",""
"FoMRHI","1986","1","42","C-675","None","Another reamer-saving counterbore","","Swayne",""
"FoMRHI","1986","1","42","C-676","None","Workshop ideas for woodwinds","","Swayne",""
"FoMRHI","1986","1","42","C-677","None","Further to Cary's C-655","","Montagu",""
"FoMRHI","1986","1","42","C-678","None","The FoMRHI network","","Karp",""
"FoMRHI","1986","1","42","C-679","None","Comments on C-666 on the Swedish gauge system","","Karp",""
"FoMRHI","1986","1","42","C-680","None","Ruckers doubles: the sixth hypothesis","","Meeùs",""
"FoMRHI","1986","1","42","C-681","None","Early pianos at Ipswich","","Barnes",""
"FoMRHI","1986","1","42","C-682","None","Bending in San Franscisco","","Greenberg",""
"FoMRHI","1986","1","42","C-683","None","18th century German and French pitches","","Segerman",""
"FoMRHI","1986","1","42","C-684","None","An exceptional G-sharp in Milan","","Lindley",""
"FoMRHI","1986","1","42","C-685","None","Early instrument news from Yugoslavia","","Vojnic",""
"FoMRHI","1986","1","42","C-686","None","A letter to J. Montagu","","Bashford",""
"FoMRHI","1986","1","42","C-687","None","Angled bridges and J bars on lutes","","Segerman",""
"FoMRHI","1986","4","43","C-688","Review","Bassart: The sound of the fortepiano: a discography of music on early pianos","","Montagu",""
"FoMRHI","1986","4","43","C-689","Review","Hamber, Stanners: Musical instruments through the ages","","Montagu",""
"FoMRHI","1986","4","43","C-690","Review","Haynes: Music for oboe, 1650-1800: a bibliography","","Montagu",""
"FoMRHI","1986","4","43","C-691","Review","Vierundzwandzigsteljahrschrift der internationalen Maultrommel-virtuosengenossenschaft 2, 1985","","Montagu",""
"FoMRHI","1986","4","43","C-692","Review","Mozart: A treatise on the fundamental principles of violin playing, (Knocker)","","Montagu",""
"FoMRHI","1986","4","43","C-693","Review","Un musée aujourd'hui - des facteurs d'instruments de musique","","Montagu",""
"FoMRHI","1986","4","43","C-694","Review","Pasquali: The art of fingering the harpsichord","illustrated with examples, etc 1757","Montagu",""
"FoMRHI","1986","4","43","C-695","Review","Jones: Musical and poetical relicks of the Welsh bards, preserved by tradition, etc 1784","","Montagu",""
"FoMRHI","1986","4","43","C-696","Review","Kjeldsberg: Piano i Norge","","Aanstad",""
"FoMRHI","1986","4","43","C-697","Review","The new Grove dictionary of musical instruments. Montagu (D-E)","","",""
"FoMRHI","1986","4","43","C-698","Review","The new Grove dictionary of musical instruments. Segerman (Ca-Ci)","","",""
"FoMRHI","1986","4","43","C-699","None","Are computers anything for us","","Karp",""
"FoMRHI","1986","4","43","C-700","None","Untitled (on computers)","","Lyndon-Jones",""
"FoMRHI","1986","4","43","C-701","None","On computers, typewriters, etc","","Champollion",""
"FoMRHI","1986","4","43","C-702","None","Untitled (non-keyboard baroque temperament)","","Haynes",""
"FoMRHI","1986","4","43","C-703","None","A matter of temperament","","Hodgson",""
"FoMRHI","1986","4","43","C-704","None","The proportional compass","","Gug",""
"FoMRHI","1986","4","43","C-705","None","A simple and cheap hygrometer","","Bergstrøm",""
"FoMRHI","1986","4","43","C-706","None","Digital and other calipers","","van Leeuwen",""
"FoMRHI","1986","4","43","C-707","None","Modification and sharpening of twist drills","","van Leeuwen",""
"FoMRHI","1986","4","43","C-708","None","Dehumidifiers","","Hope",""
"FoMRHI","1986","4","43","C-709","None","Chitarra battente","","Hope",""
"FoMRHI","1986","4","43","C-710","None","Vihuela","","Hope",""
"FoMRHI","1986","4","43","C-711","None","An experimental method","","Odell",""
"FoMRHI","1986","4","43","C-712","None","On extended lutes","","Segerman",""
"FoMRHI","1986","4","43","C-713","None","Napolitan mandolins, wire strengths and violin stringing","","Segerman",""
"FoMRHI","1986","4","43","C-714","None","Round bridges: the geometry of clearance angles","","Segerman",""
"FoMRHI","1986","4","43","C-715","None","Flat bridges I: focus on the lira da braccio","","Segerman",""
"FoMRHI","1986","4","43","C-716","None","Lyra and other viols that played from tablature","","Segerman",""
