"magazine","year","month","seq_issue","page_no","category","title","sub-title","author(s)","photographer(s)","optional-1","optional-2","optional-3"
"FoMRHI","2000","7","100","C-1725","None","Decoration and its current use","","Segerman",""
"FoMRHI","2000","7","100","C-1726","None","Why want to hear what it sounds like","","Segerman",""
"FoMRHI","2000","7","100","","Bulletin","Peterson strobe tuners","","",""
"FoMRHI","2000","7","100","","Bulletin","The Hon.Sec. & Hon.Ed. & Hon.Treas","","",""
"FoMRHI","2000","7","100","","Supplement","Further on Praetorius's pitch","","Segerman",""
"FoMRHI","2000","10","101","C-1727","Review","The Renaissance Workshop Company Ltd. Ottavino spinet","plan and construction manual","Jones",""
"FoMRHI","2000","10","101","C-1728","Review","Bernard Brauchli, ed. De clavicordio III: proceedings of the international clavichord symposium, Magnano, Italy 23-28 September 1997","","Jones",""
"FoMRHI","2000","10","101","C-1729","Review","Bouwerskontakt Bouwbrief 96-98, my summary","","Stroom",""
"FoMRHI","2000","10","101","C-1730","None","Museum report (St Annen Museum, Lübeck","Schloss Sonderhausen; Museum der Universität, Leipzig; Händel Haus Museum, Halle)","Dart",""
"FoMRHI","2000","10","101","C-1731","None","An improved wooden bodied bore reamer","","Catterall",""
"FoMRHI","2000","10","101","C-1732","None","Pythagoras vs Euclid (in Arnaut's Clavisimbalum)","","Barlow",""
"FoMRHI","2000","10","101","C-1733","None","The Clavisimbalum of Henri Arnaut de Zwolle","","Barlow",""
"FoMRHI","2000","10","101","C-1734","None","Horn working Nuts and Bolts","selecting raw material","Leaf",""
"FoMRHI","2000","10","101","C-1735","None","Further to C-1721, Some brief thoughts about the future of FoMRHI","","Segerman",""
"FoMRHI","2000","10","101","C-1736","None","A late 16th century French picture with instruments","","Segerman",""
"FoMRHI","2000","10","101","C-1737","None","Further to C-1723, English usage in publications","knowledge, belief, catlins, and a response","Segerman",""
"FoMRHI","2000","10","101","C-1738","Review","David Boyden. `Monteverdi's violini piccoli alla Francese' and `Viole da brazzo' in Annales Musicologiques VI","","Segerman",""
"FoMRHI","2000","10","101","C-1739","None","The Hieronymus Albrecht Hass clavichord in the Bate Collection of Historical Instruments, Faculty of Music, University of Oxford","restoration report","Jones",""
"FoMRHI","2000","10","101","","Bulletin","Nuts and Bolts comms","","Jones",""
"FoMRHI","2000","10","101","","Bulletin","Restoration and repair","","Jones",""
"FoMRHI","2000","10","101","","Supplement","Armitage","","",""
"FoMRHI","2001","1","102","C-1736","Review","Larigot Spécial 11, Septembre 2000. Essai de classification alphabétique des facteurs, ouvriers, inventeurs, essayeurs, marchands, ... français d'instruments à vent, 1re partie A-L","","Montagu",""
"FoMRHI","2001","1","102","C-1737","Review","Bouwerskontakt Bouwbrief 99, my summary","","Stroom",""
"FoMRHI","2001","1","102","C-1738","None","Acquisitions of the Kenneth G. Fiske Museum, 1999-2000","","Rice",""
"FoMRHI","2001","1","102","C-1739","None","Early pianos in Pennsylvania","","Cole",""
"FoMRHI","2001","1","102","C-1740","None","Tuning recorders by modifying the bore","","Loretto",""
"FoMRHI","2001","1","102","C-1741","None","Recorder dynamics (Dolmetsch, Breuking)","","Loretto",""
"FoMRHI","2001","1","102","C-1742","None","Top f in a treble recorder","","Robertson",""
"FoMRHI","2001","1","102","C-1743","None","Some evidence from an old violin","","Badiarov",""
"FoMRHI","2001","1","102","C-1744","None","Strings of silk and other textiles","","Rakov",""
"FoMRHI","2001","1","102","C-1745","None","Oriental colour and atmosphere: why exotic colour became prominent in 19th and early 20th century orchestration","","Little",""
"FoMRHI","2001","1","102","","Bulletin","Horn working and personal safety","","Jones",""
"FoMRHI","2001","1","102","","Bulletin","Leipzig Instrument Museum is moving","","Jones",""
"FoMRHI","2001","1","102","","Bulletin","National sound archive on-line catalogue","","Jones",""
"FoMRHI","2001","1","102","","Bulletin","Renaissance recorder database","","Jones",""
"FoMRHI","2001","1","102","","Bulletin","Textile strings","","Jones",""
"FoMRHI","2001","1","102","","Supplement","1 Apologies","","Armitage",""
"FoMRHI","2001","1","102","","Supplement","2 Loretto's windway broaching machine acquisition","","Armitage",""
"FoMRHI","2001","4","103","C-1746","None","Progress report 2000 on the collection of historic musical instruments of the Edinburgh University","","Myers",""
"FoMRHI","2001","4","103","C-1747","Review","Koen Vermeij. The Hubert Clavichord Data Book","","Jones",""
"FoMRHI","2001","4","103","C-1748","None","Horn - several more toots","","Goodacre",""
"FoMRHI","2001","4","103","C-1749","None","Comment on C-1742","","Loretto",""
"FoMRHI","2001","4","103","C-1750","None","Comment on bulletin 102","","Loretto",""
"FoMRHI","2001","4","103","C-1751","None","Catgut - C-1567 revisited","","Downing",""
"FoMRHI","2001","4","103","C-1752","None","`An angel in green with a vielle' - a reconstruction","","Skeaping",""
"FoMRHI","2001","4","103","C-1753","None","16th century rib bending","","Coleman",""
"FoMRHI","2001","4","103","C-1754","None","More on the violino Piffaro","","Heavens",""
"FoMRHI","2001","4","103","C-1755","None","About the history of the use of metal in violin strings","","Segerman",""
"FoMRHI","2001","4","103","C-1756","None","The appoggiatura, early vocal style and instrument imitations","","Segerman",""
"FoMRHI","2001","4","103","C-1757","None","When the neck length (nut to body) became 2/3 the body stop (neck to bridge) on violins and violas","","Segerman",""
"FoMRHI","2001","4","103","","Bulletin","FoMRHI Treasurer - a vacancy","","Jones",""
"FoMRHI","2001","4","103","","Bulletin","Wood auction","","Jones",""
"FoMRHI","2001","7","104","C-1758","None","Bouwerskontakt Bouwbrief l00 and 101, my summaries","","Stroom",""
"FoMRHI","2001","7","104","C-1759","Review","F Delbanco. Posaunen und Trompeten - Geschicbte, Akustike, Spieltechnik","","Montagu",""
"FoMRHI","2001","7","104","C-1760","Review","Andrew Ashbee, et al. The Viola da Gamba Society index of manuscripts containing consort music, vol 1","","Jones",""
"FoMRHI","2001","7","104","C-1761","None","Response to Eph's (Segerman) response to Lewis's (Jones) C-1721","","Montagu",""
"FoMRHI","2001","7","104","C-1762","None","Irving and historical scholarship: a lesson for music historians","","Segerman",""
"FoMRHI","2001","7","104","C-1763","None","Double chamfers","","Loretto",""
"FoMRHI","2001","7","104","C-1764","None","A synthetic finish for recorder bores","","Colebrook",""
"FoMRHI","2001","7","104","C-1765","None","The clavisimbalum from the manuscript of Arnaut de Zwolle, c. 1440","","Rennoldson",""
"FoMRHI","2001","7","104","C-1766","None","Some theory on pitch instability, inharmonicity and lowest pitch limits","","Segerman",""
"FoMRHI","2001","7","104","C-1767","None","Response to C-1744 (strings of silk and other textiles)","","Segerman",""
"FoMRHI","2001","7","104","C-1768","None","Stringing renaissance fiddles and rebecs","","Segerman",""
"FoMRHI","2001","7","104","C-1769","None","Early sound posts and bass bars","","Segerman",""
"FoMRHI","2001","7","104","C-1770","None","17th century English viols","","Segerman",""
"FoMRHI","2001","7","104","C-1771","None","Stress equilibrium and moisture content in gut and wood","","Segerman",""
"FoMRHI","2001","7","104","","Bulletin","Delays in publication - an apology","","Jones",""
"FoMRHI","2001","7","104","","Bulletin","Titles of FoMRHI Comms","","Jones",""
"FoMRHI","2001","10","105","C-1772","None","A brief response to C-1752 and Bull-103","","Montagu",""
"FoMRHI","2001","10","105","C-1773","None","The peoples organ - investigating the concertina","","Macneil",""
"FoMRHI","2001","10","105","C-1774","None","A look at the mechanics of the vibration of the bowed bridge","","Segerman",""
"FoMRHI","2001","10","105","C-1775","None","Measuring the elastic modulus of gut","","Segerman",""
"FoMRHI","2001","10","105","C-1776","None","Tables in steps for close-wound strings","","Segerman",""
"FoMRHI","2001","10","105","C-1777","None","Jerome of Moravia and the Tractatus de musica","","Skeaping",""
"FoMRHI","2001","10","105","C-1778","None","Tuning and stringing medieval fiddles","","Segerman",""
"FoMRHI","2001","10","105","C-1779","None","The anomalous size of the pardessus de viole","","Segerman",""
"FoMRHI","2001","10","105","C-1780","Review","Román Martinez Gayol. The aging process (in 'the Strad', vol 112, # 1335)","","Segerman",""
"FoMRHI","2001","10","105","C-1781","None","A timeline of 18th century bassoon makers","","Dart",""
"FoMRHI","2001","10","105","C-1782","None","Early ud fretting systems described by Al-Kindi","","Margerum",""
"FoMRHI","2001","10","105","","Bulletin","FoMRHI Treasurer - David Armitage","","Jones",""
"FoMRHI","2001","10","105","","Bulletin","Form for the submission of entries for the FoMRHI Directory of Suppliers to Musical Instrument Makers","","Jones",""
"FoMRHI","2002","1","106","C-1783","None","Progress report 2001 on the collection of historic musical instruments of the Edinburgh University","","Myers",""
"FoMRHI","2002","1","106","C-1784","Review","Larigot 27, Août 2001, Larigot 28, Décembre 2001, Larigot Spécial XII, Avril 2001, Larigot Répertoire et Listing, Avril 2001","","Montagu",""
"FoMRHI","2002","1","106","C-1785","None","On the 'English scholarly tradition' expressed in Jeremy's C-1761","","Segerman",""
"FoMRHI","2002","1","106","C-1786","None","Hornworking reference sources","","Leaf",""
"FoMRHI","2002","1","106","C-1787","None","A Workeshoppe Restor'd - an attempt to recreate a North European string instrument maker's workshop of the late 16th Century (or the search for the lute makers donkey!)","","Atkinson",""
"FoMRHI","2002","1","106","C-1788","None","Harpsichord - to build or buy","","Foster",""
"FoMRHI","2002","1","106","C-1789","None","My problems with traversos in a-440 Hz","","Bouterse",""
"FoMRHI","2002","1","106","C-1790","None","High f on the baroque alto recorder (further to C-1742 and C-1749)","","Bolton",""
"FoMRHI","2002","1","106","C-1791","None","On Downing's speculations on catgut in C-1751","","Segerman",""
"FoMRHI","2002","1","106","C-1792","None","On Skeaping's fiddle reconstruction in C-1752","","Segerman",""
"FoMRHI","2002","1","106","C-1793","None","Comments on Coleman's C-1753 on rib bending","","Segerman",""
"FoMRHI","2002","1","106","C-1794","None","The 'Angel in Green' Lyra - a response to Eph Segerman's observations on C-1792","","Skeaping",""
"FoMRHI","2002","1","106","C-1795","None","Further to C-1751 - Silkworm Gut and the Origins of the Minikin Lute String","","Downing",""
"FoMRHI","2002","1","106","C-1796","None","Silk Strings? - Putting Another Spin on Interpretation of the Sources (Further to C-1767)","","Downing",""
"FoMRHI","2002","1","106","C-1797","None","Translation of the tuning instructions in Girolamo Montesardo, 'Nuova inventione d'intavolatura per sonare li balletti sopra la chitarra spagniuola (Florence, 1606)","","Hall",""
"FoMRHI","2002","1","106","C-1798","None","A few notes on Montesardo's 5-course guitar tuning","","Segerman",""
"FoMRHI","2002","1","106","","Bulletin","Further to C-1751 (silkworms)","","Harwood",""
"FoMRHI","2002","1","106","","Bulletin","Further to C-1751 (silkworms)","","Montagu",""
"FoMRHI","2002","1","106","","Bulletin","Further to C-1765 (the clavisimbalum)","","Montagu",""
"FoMRHI","2002","1","106","","Bulletin","Further to C-1785 (reviewing of published articles)","","Jones",""
"FoMRHI","2002","1","106","","Bulletin","The violino piffaro","","Segerman",""
"FoMRHI","2002","4","107","C-1799","None","The Kloster Michaelstein Guitar and Cittern Symposium: a report","","Forrester",""
"FoMRHI","2002","4","107","C-1800","None","Spreadsheet I & F  (Ingerslev & Frobenius) calculation of organ pipe pitch","","Segerman",""
"FoMRHI","2002","4","107","C-1801","None","More ancient varnish recipes","","Owen",""
"FoMRHI","2002","4","107","C-1802","None","The clavisimbalum from the manuscript of Henri Arnaut de Zwolle, c. 1440: an update to C-1765","","Rennoldson",""
"FoMRHI","2002","4","107","C-1803","None","Bending vihuela ribs: a response to Ephraim Segerman's C-1793 on Richard Coleman's C-1753","","Hebbert",""
"FoMRHI","2002","4","107","C-1804","None","Gut strings: further to C-1683","","Peruffo",""
"FoMRHI","2002","4","107","C-1805","None","On Segerman's speculations on catgut, etc in C-1791","","Downing",""
"FoMRHI","2002","4","107","C-1806","None","Some relationships involving string displacement","","Segerman",""
"FoMRHI","2002","4","107","C-1807","None","An analysis of the bridge hole data on lutes in C-1288 and C-1350","","Segerman",""
"FoMRHI","2002","4","107","","Bulletin","A virtual Sodi harpsichord","","Jones",""
"FoMRHI","2002","4","107","","Bulletin","Joint meeting with the Lute Society","","Jones",""
"FoMRHI","2002","7","108","C-END","Announcement","FoMRHI has ceased to exist","","",""
"FoMRHI","2008","8","109","C-1808","None","Tuning temperaments for lutes","","Coakley",""
"FoMRHI","2008","8","109","C-1809","None","Elasticity of lute strings","","Coakley",""
"FoMRHI","2008","8","109","C-1810","None","Tapered lute strings, angled necks and bridges","","Coakley",""
"FoMRHI","2008","8","109","C-1811","None","Acoustics of lute soundboards and bars","","Coakley",""
"FoMRHI","2008","8","109","C-1812","None","Lute stability","","Coakley",""
"FoMRHI","2008","8","109","C-1813","None","Further acoustivs of lutes: bridge areas, minor bars, angles","","Coakley",""
"FoMRHI","2008","8","109","C-1814","None","Lute sizes and optimum design","","Coakley",""
"FoMRHI","2008","8","109","","Bulletin","Revival of FoMRHI, by Chris Goodwin, secretary, with John Rawson, treasurer","","Goodwin",""
"FoMRHI","2008","11","110","C-1815","None","On frets and barring; some useful ideas","","McConnell","",""
"FoMRHI","2008","11","110","C-1816","None","Modifications to recorder blocks to improve sound production","","Madge","",""
"FoMRHI","2008","11","110","C-1817","None","What is wrong with Vermeer's guitar","","Forrester","",""
"FoMRHI","2008","11","110","C-1818","None","A new addition to the instruments of the 'Mary Rose'","","Montagu","",""
"FoMRHI","2008","11","110","C-1819","None","Oud or lute? - a study","","Downing","",""
"FoMRHI","2008","11","110","C-1820","None","Some parallels in the ancestry of the viol and violin","","Segerman","",""
"FoMRHI","2008","11","110","C-1821","None","Notes on the polyphont","","Segerman","",""
"FoMRHI","2008","11","110","C-1822","None","The 'English' in English violette","","Segerman","",""
"FoMRHI","2008","11","110","C-1823","None","The identity of the lirone","","Segerman","",""
"FoMRHI","2008","11","110","C-1824","None","On the origins of the tuning peg and some early instrument names","","Segerman","",""
"FoMRHI","2008","11","110","C-1825","None","'Twined' strings for clavichords","","Bavington","",""
"FoMRHI","2008","11","110","C-1826","None","Wood fit for a king? An investigation","","Downing","",""
"FoMRHI","2008","11","110","C-1827","None","Temperaments for gut string and gut fretted instruments","","Catch","",""
"FoMRHI","2008","11","110","C-1828","None","Reply to Hebbert's C-1803 on early bending method","","Segerman","",""
"FoMRHI","2008","11","110","C-1829","None","Reply to Peruffo's C-1804 on gut strings","","Segerman","",""
"FoMRHI","2008","11","110","C-1830","None","Reply to Downing's C-1805 on silk and catgut","","Segerman","",""
"FoMRHI","2008","11","110","C-1831","None","On stringing of lutes in C-1807 and guitars in C-1797 and C-1798","","Segerman","",""
"FoMRHI","2008","11","110","C-1832","None","Tapered lute strings and added mass","","Coakly","",""
"FoMRHI","2008","11","110","C-1833","Review","Review: A history of the lute from Antiquity to the renaissance, by Douglas Alton Smith","Lute Society of Amerixa, 2002","Segerman","",""
"FoMRHI","2008","11","110","C-1834","Review","Review: Die Renaissanceblockflöten der Sammlung alter Musikinstrumenten des kunsthistorisches Museums Wien","Vienna, 2006","Bouterse","",""
"FoMRHI","2008","11","110","","Bulletin","The Greenwich Exhibition, Call for Papers","","Goodwin","",""
"FoMRHI","2009","2","111","C-1835","None","Jan Steenbergen and his oboes","","Bouterse","",""
"FoMRHI","2009","2","111","C-1836","None","Observations on glue and an early lute construction technique","","Downing","",""
"FoMRHI","2009","2","111","C-1837","None","Thomas Stanesby junior's 'True Concert Flute'","","Bolton","",""
"FoMRHI","2009","2","111","C-1838","None","Oil paintings of musical instruments - should we trust the Old Masters?","","Goodacre","",""
"FoMRHI","2009","2","111","C-1839","None","A method of fixing loose soundbars","","Bavington","",""
"FoMRHI","2009","2","111","C-1840","None","Mediaeval and Renaissance multiple tempo standards","","Segerman","",""
"FoMRHI","2009","2","111","C-1841","None","The earliest soundposts","","Segerman","",""
"FoMRHI","2009","2","111","C-1842","None","The historical basis of the modern earlymusic pitch standard of a' = 415 Hz","","Segerman","",""
"FoMRHI","2009","2","111","C-1843","None","Notes on the symphony","","Segerman","",""
"FoMRHI","2009","2","111","C-1844","None","Some design considerations in making flattened lute backs","","Segerman","",""
"FoMRHI","2009","2","111","C-1845","None","Tromba Marina notes","","Allen","",""
"FoMRHI","2009","2","111","C-1846","None","Woodwinds dictionary online","http://www.woodwindwords.com","Lemmel","",""
"FoMRHI","2009","2","111","C-1847","None","For information: Diderot et d'Alembert, L'Encyclopedie  free!","http://diderot.alembert.free.fr","Downing","",""
"FoMRHI","2009","2","111","C-1848","None","'Mortua dolce cano' - a question","","Downing","",""
"FoMRHI","2009","2","111","C-1849","None","'Mortua dolce cano' - two more instances","","Goodwin","",""
"FoMRHI","2009","2","111","C-1850","None","Further to C-1818, the new Mary Rose fiddle bow","","Montagu","",""
"FoMRHI","2009","2","111","C-1851","None","Oud or lute?  C-1819 continued","","Downing","",""
"FoMRHI","2009","2","111","C-1852","None","Wood fit for a king  a case of mistaken identity?","C-1826 updated","Downing","",""
"FoMRHI","2009","2","111","C-1853","None","Reply to Segerman's C-1830","(on silk and catgut)","Downing","",""
"FoMRHI","2009","2","111","C-1854","None","Reply to john Catch's C-1827 on frets and temperaments","","Munck","",""
"FoMRHI","2009","2","111","C-1855","None","C-1855 not allocated","","","",""
"FoMRHI","2009","2","111","C-1856","None","Re C-1810 and C-1815 angled bridges, tapered strings, frets and bars","","Segerman","",""
"FoMRHI","2009","2","111","C-1857","None","The lute in renaissance Spain: comment on C-1833","","Arroitajauregi","",""
"FoMRHI","2009","2","111","C-1858","Review","Review of modern clavichord studies: De Clavicordo VIII","","Weston","",""
"FoMRHI","2009","2","111","","Bulletin","","","Goodwin","",""
"FoMRHI","2009","5","112","C-1859","None","Errata in C-1858","some names were misprinted","Goodwin","",""
"FoMRHI","2009","5","112","C-1860","None","Mortua dolce cane - an answer to C-1848 and C-1849","","Forrester","",""
"FoMRHI","2009","5","112","C-1861","None","Bouwerskontakt and its publications","","Bouterse","",""
"FoMRHI","2009","5","112","C-1862","None","Further to C-1854 on fretting","","Catch","",""
"FoMRHI","2009","5","112","C-1863","None","David Hockney and 'The Ambassadors' lute","","Downing","",""
"FoMRHI","2009","5","112","C-1864","None","Oud or lute? - the Ambassadors lute seen from a computer's perspective","","Downing","",""
"FoMRHI","2009","5","112","C-1865","None","A brief review of sound hole configuration in early ouds and lutes","","Downing","",""
"FoMRHI","2009","5","112","C-1866","None","Glue - more information from the Asiatic bow makers","","Downing","",""
"FoMRHI","2009","5","112","C-1867","None","Making a recorder block","","Lynham","",""
"FoMRHI","2009","5","112","C-1868","None","Supporting claims of kithara or lyre origin","","Segerman","",""
"FoMRHI","2009","5","112","C-1869","None","On the development of early music","","Segerman","",""
"FoMRHI","2009","5","112","C-1871","None","A basic theory about string twist","","Segerman","",""
"FoMRHI","2009","5","112","C-1872","None","The Young's modulus made easy","","Louchet","",""
"FoMRHI","2009","5","112","","Bulletin","","","Goodwin","",""
"FoMRHI","2009","8","113","C-1873","None","Lute peg shank taper","includes lists from mandolinos and lutes","Downing","",""
"FoMRHI","2009","8","113","C-1874","None","More on making recorder blocks","comments on C-1867","Madge","",""
"FoMRHI","2009","8","113","C-1875","None","Every musician an instrument maker or Bach's 'viola pomposa'","'all makers must be players and all players makers' (Carl Dolmetsch)","Lahham","",""
"FoMRHI","2009","8","113","C-1876","None","English guitar makers in 18th century Britain: a directory","an inventory is included","Tyler","",""
"FoMRHI","2009","8","113","C-1877","None","A wooden ocarina","","Bouterse","",""
"FoMRHI","2009","8","113","C-1878","None","More on Youngs modulus","comments to C-1872","Downing","",""
"FoMRHI","2009","8","113","C-1879","None","Another useful free online resource","the internet archive of old books at www.archive.org","Downing","",""
"FoMRHI","2009","8","113","C-1880","None","Recorder research: windway design - part 1","measurements, techniques of old recorders","Bouterse","",""
"FoMRHI","2009","8","113","C-1881","None","Some thoughts on 'reverse' moderators in Austrian pianos at the end of the 18th century","a fortepiano made by Sebastian Lengerer, Kufstein 1793","Tiella","",""
"FoMRHI","2009","8","113","C-1882","None","A keyboard instrument in a  painting","an unsigned portrait with a keyboard instrument: an attempt to ascribe a painting","Rosenblatt","",""
"FoMRHI","2009","8","113","C-1883","None","On lute sizes","an historical approach","Segerman","",""
"FoMRHI","2009","8","113","","Bulletin","","","Goodwin","",""
"FoMRHI","2009","11","114","C-1884","None","Additions to C-1876, some more English Guitars","","Takeuchi","",""
"FoMRHI","2009","11","114","C-1885","None","An early lute construction technique, further to C-1836","","Downing","",""
"FoMRHI","2009","11","114","C-1886","None","A keyboard instrument in a photograph","a reed organ in the house of German clergy in Jerusalem","Rosenblatt","",""
"FoMRHI","2009","11","114","C-1887","None","Pinched notes","the thumb hole of the recorder","Madge","",""
"FoMRHI","2009","11","114","C-1888","None","Home-made tools for lute building","","Franklin","",""
"FoMRHI","2009","11","114","C-1889","None","Bassoon reed making","adapting the reed making technique to the material or forcing the material to the reed making technique","Rachor","",""
"FoMRHI","2009","11","114","C-1890","None","Inventing the guihuela","a radical approach to instrument accessibility","Emmet","",""
"FoMRHI","2009","11","114","C-1891","None","On an often misunderstood picture of a mediaeval fiddle","King David depicted in a Troparium, 11th cnt","Segerman","",""
"FoMRHI","2009","11","114","C-1892","None","The lost art of declamation in music performance","","Segerman","",""
"FoMRHI","2009","11","114","C-1893","None","What types of fiddles were the  Charles XI Andrea Amati instruments when made?","","Segerman","",""
"FoMRHI","2009","11","114","C-1894","None","On late 18th century archcitterns","","Segerman","",""
"FoMRHI","2009","11","114","","Bulletin","","","Goodwin","",""
"FoMRHI","2010","3","115","C-1895","None","English guitars in the Danish Music Museum, Copenhagen","additions to C-1876 and C-1884","Bergstrøm","",""
"FoMRHI","2010","3","115","C-1896","None","Design and construction of a 'multipurpose' lute","","Coakley","",""
"FoMRHI","2010","3","115","C-1897","None","How big is a lute? The statistical evidence from hand sizes","","Franklin","",""
"FoMRHI","2010","3","115","C-1898","None","Recorder research: windway design - part 2","five alto recorders by Bressan: windway and blocks","Bouterse","",""
"FoMRHI","2010","3","115","C-1899","None","A renaissance piano?","based on a spinettino in the Metropolitan Museum of Art, New York, by Franciscus Bonafinis MDLXXV","Barlow","",""
"FoMRHI","2010","3","115","C-1900","None","Reply to David Rachors C-1889 on adapting techniques to the material or not","","Barlow","",""
"FoMRHI","2010","3","115","C-1901","None","A keyboard instrument in a Metropolitan Museum, New York","a rebuilt Italian harpsichord in the Metropolitan Collection (NY): restoring a chain of events","Rosenblatt","",""
"FoMRHI","2010","3","115","C-1902","None","A clarinet from before when clarinets were invented?","the sculpture of an angel at the Plasy organ (Abraham Starck, 1688, West Bohemia)","Spicka","",""
"FoMRHI","2010","3","115","C-1903","None","On the gittern's body change round 1500","","Segerman","",""
"FoMRHI","2010","3","115","C-1904","None","The step between the top of the sides and the top of the neck of stringed instruments","","Segerman","",""
"FoMRHI","2010","3","115","C-1905","None","Angled bowing on medieval paintings","","Segerman","",""
"FoMRHI","2010","3","115","C-1906","None","Why it was the vihuela and not the lute in 16th century Spain","","Segerman","",""
"FoMRHI","2010","3","115","","None","announcing www.fomrhi.org; an electronic Fomrhi?","","Goodwin","",""
"FoMRHI","2010","8","116","C-1907","None","Lute pegs from Holbein's Ambassadors Portrait","","Franklin","",""
"FoMRHI","2010","8","116","C-1908","None","Clarinets are older than you think","reply to C-1092","Henning","",""
